{
  "$schema": "TsukiSynth Specimen Measurement v2",
  "specimen": {
    "id": "REPLACE_WITH_SPECIMEN_ID",
    "instrument_family": "cantilever_tongue",
    "serial_or_lot": "REPLACE_WITH_SERIAL_OR_LOT",
    "geometry": {
      "length_m": 0.1,
      "width_m": 0.025,
      "thickness_m": 0.002
    },
    "material": {
      "material_id": "REPLACE_WITH_MEASURED_MATERIAL_ID",
      "young_modulus_pa": 200000000000.0,
      "density_kg_m3": 7850.0,
      "poisson_ratio": 0.3
    },
    "boundary_condition": "clamped-free; clamp torque REPLACE_WITH_VALUE_NM"
  },
  "environment": {
    "temperature_c": 23.0,
    "relative_humidity_pct": 50.0,
    "pressure_kpa": 101.325
  },
  "acquisition": {
    "laboratory": "REPLACE_WITH_LAB",
    "operator": "REPLACE_WITH_OPERATOR_OR_AUTOMATION_ID",
    "captured_at_utc": "2026-08-02T00:00:00Z",
    "method": "impact_hammer_frf",
    "sample_rate_hz": 96000,
    "averages": 8,
    "frequency_resolution_hz": 0.25,
    "uncertainty_coverage_factor": 2.0,
    "excitation_point_xyz_m": [0.09, 0.0, 0.0],
    "excitation_direction_xyz": [0.0, 0.0, 1.0],
    "response_point_xyz_m": [0.08, 0.0, 0.0],
    "response_quantity": "acceleration_m_s2"
  },
  "artifacts": [],
  "model": {
    "event_source_index": 0,
    "mode_dump_path": "GENERATED_BY_PIPELINE",
    "mode_dump_sha256": "0000000000000000000000000000000000000000000000000000000000000000",
    "uncertainty": {
      "frequency_relative_pct": 0.5,
      "relative_magnitude_db": 1.0,
      "t60_relative_pct": 10.0,
      "phase_deg": 5.0,
      "absolute_level_db": 1.0,
      "directivity_db": 1.0,
      "directivity_phase_deg": 5.0
    }
  },
  "claim_scope": {
    "modal_frequencies": true,
    "relative_modal_magnitudes": true,
    "modal_t60": true,
    "complex_phase": true,
    "absolute_spl": true,
    "radiation_directivity": true
  },
  "acceptance": {
    "min_mode_count": 5,
    "min_coherence": 0.9,
    "max_frequency_error_pct": 2.0,
    "max_relative_magnitude_error_db": 3.0,
    "max_t60_ratio": 1.25,
    "max_phase_error_deg": 15.0,
    "max_absolute_level_error_db": 3.0,
    "min_directivity_points": 12,
    "max_directivity_error_db": 3.0,
    "max_directivity_phase_error_deg": 20.0
  },
  "relative_magnitude_reference_partial_index": 0,
  "measured_modes": []
}
